{
  "$schema": "https://commandlayer.org/agent-cards/schemas/v1.0.0/_shared/agent.card.base.schema.json",
  "$id": "https://commandlayer.org/agent-cards/agents/v1.0.0/commons/cleanagent.eth.json",
  "id": "cleanagent.eth",
  "slug": "cleanagent",
  "display_name": "Clean Agent",
  "description": "Official protocol-level reference agent for the clean verb. Performs content sanitization, normalization, redaction, and safe-preprocessing operations according to the clean.request and clean.receipt schemas.",
  "owner": "commandlayer.eth",
  "ens": "cleanagent.eth",
  "version": "1.0.0",
  "status": "protocol_reference",
  "class": "commons",
  "implements": [
    "clean"
  ],
  "schemas": {
    "request": "ipfs://bafybeigvf6nkzws7dblos74dqqjkguwkrwn4a2c27ieygoxmgofyzdkz6m/commons/clean/requests/clean.request.schema.json",
    "receipt": "ipfs://bafybeigvf6nkzws7dblos74dqqjkguwkrwn4a2c27ieygoxmgofyzdkz6m/commons/clean/receipts/clean.receipt.schema.json"
  },
  "schemas_mirror": {
    "request": "https://github.com/commandlayer/commandlayer-clas/tree/main/schemas/v1.0.0/commons/clean/requests/clean.request.schema.json",
    "receipt": "https://github.com/commandlayer/commandlayer-clas/tree/main/schemas/v1.0.0/commons/clean/receipts/clean.receipt.schema.json"
  },
  "entry": "x402://cleanagent.eth/clean/v1.0.0",
  "capabilities": {
    "operations": [
      "strip_noise",
      "normalize_whitespace",
      "remove_tracking_parameters",
      "redact_sensitive_data",
      "standardize_formatting"
    ],
    "input_types": [
      "text/plain",
      "text/markdown",
      "application/json"
    ],
    "output_types": [
      "text/plain",
      "text/markdown",
      "application/json"
    ]
  },
  "meta": {
    "publisher": "CommandLayer",
    "contact": "dev@commandlayer.org",
    "pgp_fingerprint": "5016 D496 9F38 22B2 C5A2 FA40 99A2 6950 197D AB0A",
    "tags": [
      "clean",
      "sanitize",
      "normalize",
      "redact",
      "protocol-reference"
    ]
  },
  "networks": [
    "eip155:1"
  ],
  "license": "Apache-2.0",
  "created_at": "2025-11-22T00:00:00Z",
  "updated_at": "2025-11-22T00:00:00Z"
}
