{
  "$schema": "https://commandlayer.org/agent-cards/schemas/v1.0.0/_shared/agent.card.base.schema.json",
  "$id": "https://commandlayer.org/agent-cards/agents/v1.0.0/commercial/authorizeagent.eth.json",

  "id": "authorizeagent.eth",
  "slug": "authorizeagent",
  "display_name": "Authorize Agent",
  "description": "Commercial reference agent for the authorize verb. Creates and manages payment authorizations or mandates without immediate capture.",

  "owner": "commandlayer.eth",
  "ens": "authorizeagent.eth",
  "version": "1.0.0",
  "status": "protocol_reference",
  "class": "commercial",

  "implements": ["authorize"],

  "schemas": {
    "request": "https://github.com/commandlayer/commandlayer-clas/tree/main/schemas/v1.0.0/commercial/authorize/requests/authorize.request.schema.json",
    "receipt": "https://github.com/commandlayer/commandlayer-clas/tree/main/schemas/v1.0.0/commercial/authorize/receipts/authorize.receipt.schema.json"
  },
  "schemas_mirror": {
    "request": "https://ipfs.io/ipfs/bafybeiftjpyw6lwy3zm52sipbbwryssg5hoyu2qhr53j5gaqjvwfgfc344/commercial/authorize/requests/authorize.request.schema.json",
    "receipt": "https://ipfs.io/ipfs/bafybeiftjpyw6lwy3zm52sipbbwryssg5hoyu2qhr53j5gaqjvwfgfc344/commercial/authorize/receipts/authorize.receipt.schema.json"
  },

  "entry": "x402://authorizeagent.eth/authorize/v1.0.0",

  "capabilities": {
    "operations": [
      "create_authorization",
      "refresh_authorization",
      "cancel_authorization"
    ],
    "input_types": ["application/json"],
    "output_types": ["application/json"]
  },

  "meta": {
    "publisher": "CommandLayer",
    "contact": "dev@commandlayer.org",
    "pgp_fingerprint": "5016 D496 9F38 22B2 C5A2 FA40 99A2 6950 197D AB0A",
    "tags": ["authorize", "commercial", "payments", "mandates"]
  },

  "networks": ["eip155:1"],
  "license": "Apache-2.0",

  "created_at": "2025-11-22T00:00:00Z",
  "updated_at": "2025-11-22T00:00:00Z"
}
